{
  "schema_version": "newsletter.v1",
  "issue_id": "2026-10-17",
  "revision": 1,
  "generated_at": "2026-10-17T12:07:07+03:00",
  "timezone": "Asia/Jerusalem",
  "coverage": {
    "start": "2026-10-11",
    "end": "2026-10-17"
  },
  "title": "Weekly AI & Agentic Systems Digest — October 11–17, 2026",
  "summary": "This week tightened the operating model around production agents: AgentCore changed memory economics and expanded regulated web-search deployment options; GitHub added native workflow supply-chain locking and moved agentic security remediation to GA; Google previewed Gemini 4 Argon with long-context and computer-use capabilities; and Reflection released an open-weight coding model with AWS deployment paths. The practical theme is controlled autonomy: budget state explicitly, lock automation dependencies, keep generated fixes behind deterministic checks, and reproduce vendor security and performance claims before changing production routes.",
  "developments": [
    {
      "id": "agentcore-memory-consumption-pricing",
      "title": "AgentCore short-term memory moves to consumption-based pricing",
      "status": "ga",
      "event_date": "2026-10-12",
      "availability": "The pricing change applies automatically in every AWS Region where Amazon Bedrock AgentCore Memory is available.",
      "what_changed": "AWS replaced the flat short-term-memory event charge with separate ingestion, retrieval, and storage dimensions. AWS lists $1.00 per GB ingested, $0.20 per GB retrieved, and $0.10 per GB-month stored, with 12 KB minimum and 64 KB maximum billable size per event; long-term-memory pricing is unchanged.",
      "why_it_matters": "Agent state cost now depends on payload size, write frequency, retrieval behavior, and retention instead of event count alone.",
      "platform_impact": "FinOps and architecture teams need memory telemetry by agent, tenant, event size, retrieval path, and time-to-live so routing or prompt changes do not silently increase state cost.",
      "recommended_action": "Replay one week of representative memory traffic against the new dimensions and identify the three largest cost drivers before changing retention or summarization policy.",
      "watchouts": "The 12 KB minimum can make many small events inefficient; estimates should use billable event sizes rather than raw payload totals.",
      "confidence": "high",
      "score": 21,
      "citation_ids": [
        "src-01"
      ],
      "prior_issue": null,
      "new_delta": null
    },
    {
      "id": "github-actions-workflow-lockfiles",
      "title": "GitHub Actions adds native workflow dependency lockfiles in public preview",
      "status": "preview",
      "event_date": "2026-10-14",
      "availability": "Public preview for GitHub Enterprise Cloud, Enterprise Cloud with data residency, Team, and Free; organizations and enterprises can require lockfiles through policy.",
      "what_changed": "GitHub introduced .github/workflows/actions.lock to record exact commits for actions, transitive action dependencies, and reusable workflows while workflow YAML can retain readable tags or branches. Dependabot updates affected lock entries, and an optional policy can require valid lockfiles.",
      "why_it_matters": "This creates a native control against moved tags and unreviewed transitive changes in workflows that often hold deployment and cloud credentials.",
      "platform_impact": "AWS deployment pipelines can keep readable workflow definitions while enforcing immutable dependency resolution for jobs that assume IAM roles or deploy to ECR, ECS, EKS, Lambda, CDK, or Terraform.",
      "recommended_action": "Enable lockfiles on one AWS deployment repository, require them in policy, and test a Dependabot action update plus a deliberately stale lockfile.",
      "watchouts": "A locked commit is immutable, not necessarily trustworthy; provenance review and least-privilege credentials remain necessary, and the feature is still preview.",
      "confidence": "high",
      "score": 19,
      "citation_ids": [
        "src-03"
      ],
      "prior_issue": null,
      "new_delta": null
    },
    {
      "id": "github-agentic-autofix-ga",
      "title": "GitHub Agentic Autofix for code-scanning alerts reaches GA",
      "status": "ga",
      "event_date": "2026-10-15",
      "availability": "Generally available for organizations using GitHub Code Security or GitHub Advanced Security on GitHub Enterprise Cloud; administrators can control availability by enterprise or organization policy.",
      "what_changed": "GitHub made Agentic Autofix generally available. Copilot coding agent can inspect a code-scanning alert, explore the repository, propose a remediation, rerun CodeQL, iterate, and open a draft pull request. Teams can assign one alert or batch up to 25 alerts into one pull request.",
      "why_it_matters": "Security remediation is moving from suggested patches toward agent-driven repository changes that enter the standard review and release path.",
      "platform_impact": "Generated fixes need issue-scoped permissions, isolated branches, deterministic security and test gates, protected environments, human approval for sensitive repositories, and cost controls for AI Credits and Actions minutes.",
      "recommended_action": "Pilot ten medium-severity CodeQL alerts in non-critical repositories and compare acceptance rate, regression rate, review time, and credit consumption with the existing remediation process.",
      "watchouts": "Agentic Autofix can accelerate a proposed fix but does not prove semantic correctness or eliminate reviewer responsibility; it also consumes Code Security AI Credits and GitHub Actions minutes.",
      "confidence": "high",
      "score": 18,
      "citation_ids": [
        "src-04"
      ],
      "prior_issue": null,
      "new_delta": null
    },
    {
      "id": "gemini-4-argon-preview",
      "title": "Google previews Gemini 4 Argon for long-context and computer-use agents",
      "status": "preview",
      "event_date": "2026-10-13",
      "availability": "Preview through the Gemini API and Vertex AI, with additional availability across Google agent and developer surfaces; production terms and support vary by surface.",
      "what_changed": "Google introduced Gemini 4 Argon with a one-million-token context window, multimodal input, computer use, tool use, and support for long-running agent workflows. Google also described seven layers of agent protection and reports materially lower prompt-injection success than its previous generation in its own testing.",
      "why_it_matters": "Argon is a competitive reference point for long-context, browser, coding, and computer-use workloads where model quality and runtime containment must be evaluated together.",
      "platform_impact": "Bedrock-centered teams should keep model evaluation separate from orchestration policy: reproduce computer-use tasks, prompt-injection resistance, latency, and cost while enforcing equivalent tool schemas, runtime isolation, approvals, and output validation in AgentCore.",
      "recommended_action": "Add Argon to a non-production bake-off of 25 browser and long-context tasks, with identical attack prompts and side-effect limits across models.",
      "watchouts": "The security and benchmark results are Google-reported and preview availability is not uniform across every interface; do not treat them as independent production evidence.",
      "confidence": "high",
      "score": 16,
      "citation_ids": [
        "src-05",
        "src-06"
      ],
      "prior_issue": null,
      "new_delta": null
    },
    {
      "id": "agentcore-web-search-regional-expansion",
      "title": "AgentCore Web Search expands to GovCloud and three additional Regions",
      "status": "ga",
      "event_date": "2026-10-15",
      "availability": "Newly available in US East (Ohio), US West (Oregon), Asia Pacific (Sydney), and AWS GovCloud (US-West), in addition to existing Regions.",
      "what_changed": "AWS expanded Amazon Bedrock AgentCore Web Search to four more Regions, including GovCloud. The service provides managed web search with filters, citations, and an interactive browser mode for agents.",
      "why_it_matters": "The expansion creates new deployment options for latency-sensitive and public-sector agent workloads without moving the rest of the AgentCore control plane to another provider.",
      "platform_impact": "Architecture and compliance reviews must still distinguish the Region hosting the service from the location and policy of external web content, outbound requests, logs, and downstream model inference.",
      "recommended_action": "For one regulated workload, document the full web-search data path in the intended Region and verify egress policy, citation retention, logging, and unsupported destinations.",
      "watchouts": "Regional service availability does not by itself establish that fetched web content or every downstream model call remains in-region or satisfies a specific compliance regime.",
      "confidence": "high",
      "score": 19,
      "citation_ids": [
        "src-02"
      ],
      "prior_issue": null,
      "new_delta": null
    },
    {
      "id": "reflection-beam-open-weight",
      "title": "Reflection releases Beam as an open-weight coding model with AWS deployment paths",
      "status": "open_source",
      "event_date": "2026-10-16",
      "availability": "Weights are available under Apache 2.0; AWS documents SageMaker JumpStart availability in US East (N. Virginia) and US East (Ohio) plus deployment paths using JumpStart, HyperPod, SGLang, vLLM, and AWS Trainium3.",
      "what_changed": "Reflection released Beam, its first open-weight model, for agentic coding and multi-step software tasks. AWS added managed and self-hosted deployment guidance, including optimized execution on Trainium3.",